{
  "schemaVersion": "agent-eval-repo-change-assurance-report-1",
  "id": "repo-change-assurance-report-fixture-1",
  "version": "0.1.0",
  "experimentId": "experiment-fixture-1",
  "caseId": "repo-change-case-fixture-1",
  "cellId": "cell-fixture-1",
  "attemptId": "attempt-fixture-1",
  "armId": "arm-fixture-1",
  "workspaceDiffDigest": "sha256:376c2eda8818aa971c3c257d0c9573e55c69f695717fb99e60bde6ab3b141f03",
  "reportVerdict": "pass",
  "summary": "The delivered code and test changes satisfy the requested greeting behavior and the reported deterministic check.",
  "checks": [
    {
      "id": "implementation-behavior",
      "status": "pass",
      "evidenceRefs": [
        "src/greeting.js"
      ]
    },
    {
      "id": "regression-test",
      "status": "pass",
      "evidenceRefs": [
        "test/greeting.test.js"
      ]
    }
  ]
}
